title,content,source_name,published_at
Donald Trump named Time magazine's 'Person of the Year',"President-elect Donald Trump has been named Time magazine's ""2024 Person of the Year,"" it was announced on Thursday.
The feature story includes an interview with Trump, in which he discusses immigra… [+106 chars]",ABC News,2024-12-12T13:44:01Z
Trump May Split Up America’s Cyber Agencies,The U.S. government has spent years debating what the exact bureaucratic structure that governs America’s cyber agencies should be. Some people think there should be one person overseeing both the Na… [+3370 chars],Gizmodo.com,2024-12-12T14:35:04Z
"No, Trump Can’t Just ‘Dismiss’ the Senate","Donald Trump has not even returned to office, and already a constitutional crisis may be in the making. Trump has started announcing the people he intends to nominate for positions in his new adminis… [+8141 chars]",The Atlantic,2024-12-06T12:00:00Z
What Trump Doesn’t Understand About the Military,"In 1783, George Washington faced a potential mutiny of the Army. Two years after Cornwallis surrendered at Yorktown, Congress still hadn’t paid American servicemen and was repudiating promised pensio… [+7148 chars]",The Atlantic,2024-11-30T12:00:00Z
The Bizarre Normalcy of Trump 2.0,A very strange disjuncture has opened up in Washington between the serene mood and the alarming developments that are under way. The surface is calm because the Republican presidential candidate won … [+5470 chars],The Atlantic,2024-12-09T19:03:00Z
Canadian Prime Minister Trudeau Meets With Trump in Florida Amid Tariffs Threat,"WEST PALM BEACH, Fla. Canadian Prime Minister Justin Trudeau flew to Florida on Friday to have dinner with President-elect Donald Trump at his Mar-a-Lago club after Trump threatened to impose sweepin… [+5955 chars]",Time,2024-11-30T15:38:03Z
California Lawmakers to Begin Special Session to ‘Trump-Proof’ State Laws,"SACRAMENTO, Calif. California Gov. Gavin Newsom and state lawmakers will return to the state Capitol on Monday to begin a special session to protect the state's progressive policies ahead of another … [+4864 chars]",Time,2024-12-02T16:36:09Z
Team Trump Takes Credit for Israel-Hezbollah Ceasefire Before Taking Office,The Biden administration kept President-elect Donald Trumps incoming administration closely apprised of its efforts to broker the ceasefire deal between Israel and Hezbollah that took effect early We… [+5778 chars],Time,2024-11-27T03:45:00Z
"For U.S. Ambassador to China, Trump Taps Former Senator David Perdue","President-elect Donald Trump said Thursday he is choosing former Sen. David Perdue of Georgia to be ambassador to China.
Trump said in a social media post that Perdue, a former CEO, brings valuable … [+2870 chars]",Time,2024-12-06T04:00:00Z
Biden Faces Last-Minute Push to Clear Death Row Before Trump Restarts Executions,"Five days before Joe Biden was sworn in as President and effectively stopped federal executions, the Trump Administration executed its 13th federal inmate, Dustin Higgs. Higgs was sentenced to die by… [+4943 chars]",Time,2024-12-13T12:00:00Z
Trump Says He’ll Attend Notre Dame Cathedral Reopening Celebration in Paris This Weekend,"NEW YORK President-elect Donald Trump will attend the reopening celebration for Notre Dame Cathedral in Paris this weekend, his first foreign trip since the election.
The cathedral is set to reopen … [+5724 chars]",Time,2024-12-03T12:06:45Z
Trump Travels to Paris for Notre Dame Cathedral’s Reopening and to Meet With Macron,"PARIS Donald Trump is off on his first international trip as president-elect, ready to join world leaders and dignitaries in Paris for a Saturday celebration of the renovation of Notre Dame Cathedral… [+3851 chars]",Time,2024-12-07T11:38:59Z
Trump Says U.S. Shouldn’t Intervene in Syria as Opposition Forces Gain Ground,"WASHINGTON President-elect Donald Trump said Saturday that the United States should avoid engaging militarily in Syria amid an opposition offensive that has reached the capital's suburbs, declaring i… [+3550 chars]",Time,2024-12-07T18:10:59Z
‘There’s Something Causing It.’ Trump Draws False Link Between Vaccines and Autism in TIME Interview,President-elect Donald Trump said in a new interview that he would consider altering childhood vaccination programs in the United States and questioned whether vaccines cause autisma widely disproven… [+7437 chars],Time,2024-12-12T12:51:00Z
"Mitt Romney’s Senate Exit May Create a Vacuum of Vocal, Conservative Trump Critics","SALT LAKE CITY With Mitt Romney set to exit the U.S. Senate, Washington will be without one of its strongest conservative critics of Donald Trump when the president retakes the White House in the new… [+1939 chars]",Time,2024-12-13T12:46:08Z
The Story Behind TIME’s Donald Trump 2024 Person of the Year Cover,"As Platon guided President-elect Donald Trump to a simple wooden box on the set of the TIME Person of the Year photo shoot at Mar-a-Lago in November, he declared, More world leaders have sat on that … [+3159 chars]",Time,2024-12-12T12:43:00Z
What Trump Said About Elon Musk in his TIME Person of the Year Interview,"This article is part of The D.C. Brief, TIMEs politics newsletter. Sign up here to get stories like this sent to your inbox.
President-elect Donald Trump tells TIME in his Person of the Year intervi… [+4609 chars]",Time,2024-12-12T16:06:29Z
How Long Will the Trump Crypto Boom Last?,"Last week, after Donald Trump announced that he would nominate Paul Atkins, a cryptocurrency advocate, to head the Securities and Exchange Commission (S.E.C.), the price of a Bitcoin topped a hundred… [+8126 chars]",The New Yorker,2024-12-09T11:00:00Z
Trump says he isn't worried about potential conflicts of interest at Musk's DOGE: 'Elon puts the country long before his company',"President-elect Donald Trump said he is not concerned about the potential conflicts of interest posed by Elon Musk's work on DOGE.Brandon Bell/Getty Images
<ul><li>Donald Trump said Elon Musk won't … [+2732 chars]",Business Insider,2024-12-12T18:42:27Z
Trump has shadow picks for Pentagon chief if Pete Hegseth drops out. The former Fox News host says he won't back down.,"Possible replacements for defense secretary nominee Pete Hegseth include Ron DeSantis, Joni Ernst, and Elbridge Colby.Getty Images/Business Insider
<ul><li>Trumpworld is apparently reconsidering Pet… [+8068 chars]",Business Insider,2024-12-05T16:39:24Z
Why Gen Z Men Voted for Trump,"A few years ago I was hired to help revise a psychology textbook to make it more engaging for Gen Z. I’m a millennial, but my younger brother is Gen Z (“digital natives” born between 1997 and 2012), … [+9640 chars]",Scientific American,2024-12-04T12:30:00Z
Why On Earth Is a Prominent Democrat Telling Biden to Pardon Trump?,"This is Totally Normal Quote of the Day, a feature highlighting a statement from the news that exemplifies just how extremely normal everything has become.
Yes I do think so, and I think he should p… [+4795 chars]",Slate Magazine,2024-12-11T10:45:00Z
"Trump taps Kash Patel for FBI director, an ally who would aid in his effort to upend law enforcement","If you click 'Accept all', we and our partners, including 237 who are part of the IAB Transparency &amp; Consent Framework, will also store and/or access information on a device (in other words, use … [+678 chars]",Yahoo Entertainment,2024-12-01T00:04:45Z
"At Fox Nation awards ceremony, Trump boasts about recent conversations with foreign leaders, promises to 'look at' election system","If you click 'Accept all', we and our partners, including 237 who are part of the IAB Transparency &amp; Consent Framework, will also store and/or access information on a device (in other words, use … [+678 chars]",Yahoo Entertainment,2024-12-06T13:18:00Z
Trump Guitars backtracks after Gibson cease and desist and takes Les Paul-style guitars off the market,"Yahoo is using AI to generate takeaways from this article. This means the info may not always match what's in the article. Reporting mistakes helps us improve the experience.Generate Key Takeaways
W… [+2271 chars]",Guitar World,2024-12-03T12:34:28Z
"Trump says he will have ‘big discussion’ about ending childhood vaccination programs with Kennedy, could scrap some vaccines","If you click 'Accept all', we and our partners, including 237 who are part of the IAB Transparency &amp; Consent Framework, will also store and/or access information on a device (in other words, use … [+678 chars]",Yahoo Entertainment,2024-12-12T14:30:38Z
Trump Taps Billionaire Space Tourist Jared Isaacman to Lead NASA,"President-elect Donald Trump has selected Jared Isaacman, entrepreneur, pilot, and all-around space enthusiast, as the next NASA administrator, marking a major shift in the space agency’s leadership.… [+4071 chars]",Gizmodo.com,2024-12-04T20:15:41Z
Trump Names Elon Musk’s Pal as ‘AI and Crypto Czar’,"President-elect Trump has announced that David Sacks will serve as his White House A.I. &amp; Crypto Czar, according to a post from his account on Truth Social. Sacks is a venture capitalist and host… [+4188 chars]",Gizmodo.com,2024-12-06T17:20:12Z
Trump picks loyalist ex-aide as FBI director,"US President-elect Donald Trump has picked a former aide, Kash Patel, to lead the Federal Bureau of Investigation, an agency Patel has often criticised.
A former US defence department chief of staff… [+5616 chars]",BBC News,2024-12-01T17:24:10Z
Biden considering pre-emptive pardons for Trump critics - sources,"Outgoing US President Joe Biden is considering pre-emptive pardons for prominent critics of his successor Donald Trump, multiple people familiar with the discussions have told CBS, the BBC's US partn… [+3078 chars]",BBC News,2024-12-06T05:16:42Z
Trump picks investment banker Warren Stephens as UK ambassador,"President-elect Donald Trump has nominated businessman Warren Stephens to serve as Americas ambassador to the United Kingdom.
Warren has always dreamed of serving the United States full time, Trump … [+899 chars]",BBC News,2024-12-02T23:50:19Z
Hit by blackouts Cuba’s tourism industry now braces for Trump,"Canadian tourists, such as these taking part in an exercise class, are vital to the Cuban tourism sector
With winter nights drawing in across North America, Canadian snowbirds citizens who flee thei… [+6888 chars]",BBC News,2024-12-09T00:05:12Z
Trump vows to end 'very costly' daylight saving time,"US President-elect Donald Trump has said he wants to end daylight saving time (DST), arguing that it is ""inconvenient"" and ""very costly"" to Americans.
DST is the practice of moving the clock ahead b… [+1184 chars]",BBC News,2024-12-13T21:46:57Z
Trump asks to dismiss Georgia election interference case over presidential immunity,"Donald Trump's Georgia election interference case should be dismissed because a sitting president is immune from criminal prosecution, the president-elect's lawyer told a Georgia appeals court on Wed… [+2357 chars]",ABC News,2024-12-04T21:29:15Z
"Trump appoints ambassadors Kimberly Guilfoyle and Tom Barrack, plus 5 more picks","President-elect Donald Trump posted a flurry of announcements to his Truth Social account on Tuesday night, including the appointment of Kimberly Guilfoyle as the ambassador to Greece and Tom Barrack… [+6151 chars]",ABC News,2024-12-11T05:38:35Z
Trump announces new role for his administration: 'White House AI and crypto czar',"President-elect Donald Trump announced he created a new role for his administration, White House Artificial Intelligence and Crypto Czar.
Filling the role will be tech entrepreneur and podcast host … [+1731 chars]",ABC News,2024-12-06T05:37:39Z
"Trump takes credit for bitcoin surpassing $100,000. Is it too late to buy?","The price of bitcoin topped $100,000 for the first time ever late Wednesday, and soared to a fresh high in early trading on Thursday.
The new gains extended a rally set off by the election of former… [+3958 chars]",ABC News,2024-12-05T16:56:22Z
Trump shows public support for embattled defense secretary pick Pete Hegseth,"President-elect Donald Trump on Friday made his first public show of support for Pete Hegseth, his embattled pick for defense secretary, since Hegseth began making the rounds on Capitol Hill speaking… [+2736 chars]",ABC News,2024-12-06T14:25:13Z
"At Fox Nation ceremony, Trump boasts about recent conversations with foreign leaders","After receiving Fox Nation's ""Patriot of the Year Award"" Thursday night, President-elect Donald Trump spoke about recent conversations with the leaders of Canada and Mexico, promised a review of U.S.… [+2207 chars]",ABC News,2024-12-06T17:00:18Z
"As Hegseth fights to head Pentagon, Trump not working the phones to save him: Sources","Pete Hegseth, President-elect Donald Trumps pick for defense secretary, was back on Capitol Hill on Thursday to meet with Republican lawmakers as misconduct allegations continued to cloud his selecti… [+1840 chars]",ABC News,2024-12-05T15:14:36Z
Trump and giveaways: What Musk spent $270M on during the election,"Tesla and X CEO Elon Musk spent over a quarter of a billion dollars to help get President-elect Donald Trump back in the White House, according to newly released campaign finance records.
The billio… [+3020 chars]",ABC News,2024-12-06T20:00:09Z
Chinese entrepreneur sued for fraud invests $30 million in Trump crypto venture,A sudden infusion of $30 million into Donald Trump's nascent cryptocurrency venture from a Chinese billionaire sued by the Securities and Exchange Commission for allegedly defrauding investors could … [+9110 chars],ABC News,2024-12-06T21:17:14Z
"Trump doubles down on support for Pete Hegseth, admits he's unsure he'll be confirmed","In his first network TV interview since being elected, Donald Trump explained why he is still standing behind his Defense Secretary nominee Pete Hegseth, claiming hes heard how Senators are coming ar… [+2598 chars]",ABC News,2024-12-07T03:12:54Z
Trump promises pardon for Jan 6 rioters on his first day,"In his first network TV interview since his electoral victory, President-elect Donald Trump went through a range of his campaign promises, including those on immigration, health care, and his plans f… [+3411 chars]",ABC News,2024-12-08T20:56:54Z
"Cheney, Schiff push back after Trump says Jan. 6 committee members should be jailed","President-elect Donald Trump, in his first broadcast news interview since the election, said members of the House committee that investigated the attack on the U.S. Capitol on Jan. 6, 2021, should be… [+4269 chars]",ABC News,2024-12-09T16:50:52Z
"Tulsi Gabbard, Kash Patel and more Trump picks make the rounds on Capitol Hill","President-elect Donald Trump's picks for defense secretary, Pete Hegseth, and director of national intelligence, Tulsi Gabbard, are continuing to try to shore up support with senators ahead of confir… [+3384 chars]",ABC News,2024-12-12T16:57:49Z
Eric Adams meets with Trump border czar to talk NYC's role in new immigration policy,"New York City Mayor Eric Adams met with incoming border czar Thomas Homan to discuss their plans to remove what he says were violent undocumented immigrants.
Thursday's closed-door meeting was the l… [+3887 chars]",ABC News,2024-12-12T22:20:29Z
"Trump, Macron meet in Paris: 'World is going a little crazy right now'","President-elect Donald Trump kicked off his first foreign trip since his reelection with a meeting with French President Emmanuel Macron at the Elysee Palace.
Ahead of the meeting, Macron welcomed T… [+2251 chars]",ABC News,2024-12-07T17:00:33Z
"At Fox News ceremony, Trump boasts about recent conversations with foreign leaders","After receiving Fox News' ""Patriot of the Year Award"" Thursday night, President-elect Donald Trump spoke about recent conversations with the leaders of Canada and Mexico, promised a review of U.S. el… [+2203 chars]",ABC News,2024-12-06T05:27:21Z
RNC Co-Chair Lara Trump to step down amid speculation about Florida senate seat,"Lara Trump, the daughter-in-law of President-elect Donald Trump whom he tapped to co-chair the Republican National Committee for the 2024 election cycle, said she intends to step down from her positi… [+871 chars]",ABC News,2024-12-09T07:36:36Z
Trump says rivals should be in jail. Experts say Biden can pardon them beforehand.,"As President Joe Biden weighs whether to issue preemptive pardons to people President-elect Donald Trump has vowed to seek retribution against and even prosecute, experts said he has the power to do … [+8162 chars]",ABC News,2024-12-09T21:45:00Z
MAGA pressure on senators over Trump Cabinet picks shows early signs of paying off,A pressure campaign from allies of Donald Trump toward Senate Republican skeptics of some of his Cabinet picks appears to be starting to pay off in a sign of the president-elect's anticipated sway on… [+6364 chars],ABC News,2024-12-10T23:22:10Z
"Assad's fall puts new scrutiny on Tulsi Gabbard, Trump intelligence pick","Although she was just in her mid-20s, Tulsi Gabbard's hair had already started turning white shortly before she first set foot in the U.S. Senate as a legislative aide in 2006.
Coming from her nativ… [+7500 chars]",ABC News,2024-12-10T13:07:23Z
Watchdog raises concerns over Trump-era leak probes of members of Congress,A top government watchdog raised concerns Tuesday over the handling of leak investigations during the first Trump administration that targeted members of Congress and the media despite finding no evi… [+4973 chars],ABC News,2024-12-10T17:56:50Z
"Trump names Kari Lake director of Voice of America, gives his donors ambassadorships","President-elect Donald Trump announced that Kari Lake, a former news anchor and Arizona Senate candidate, would be the next director of the publicly funded Voice of America network. The update came a… [+3544 chars]",ABC News,2024-12-12T04:58:58Z
"Trump backs dockworkers' fight against automation. He risks price hikes, experts say","President-elect Donald Trump this week voiced support for tens of thousands of unionized dockworkers in a dispute with major shipping companies.
Negotiations between workers and management are deadl… [+6183 chars]",ABC News,2024-12-13T22:39:46Z
"Willis rebuffs GOP lawmaker's request for documents, says Trump case is 'ongoing'",Fulton County District Attorney Fani Willis on Thursday rebuffed the latest request from House Judiciary Chairman Jim Jordan seeking information related to her Georgia election interference investiga… [+1790 chars],ABC News,2024-12-14T02:49:50Z
Convicted Jan. 6 rioter says retired congressman invited him to Trump inauguration,A California man who pleaded guilty to a felony for his participation in the Jan. 6 attack on the U.S. Capitol filed a letter Wednesday showing he was personally invited by a retired Republican congr… [+2014 chars],ABC News,2024-12-11T22:18:38Z
Fox News AI Newsletter: 'Trump will be very good at' AI infrastructure,"Welcome to Fox News Artificial Intelligence newsletter with the latest AI technology advancements.
IN TODAYS NEWSLETTER:
- OpenAI CEO Sam Altman looking forward to working with Trump admin, says US… [+2025 chars]",Fox News,2024-12-07T13:30:30Z
Europe on Collision Course With Trump on Big Tech Crackdown,"If you click 'Accept all', we and our partners, including 237 who are part of the IAB Transparency &amp; Consent Framework, will also store and/or access information on a device (in other words, use … [+678 chars]",Yahoo Entertainment,2024-12-09T05:00:00Z
"Trump considers privatizing U.S. Postal Service, Washington Post reports","(Reuters) -U.S. President-elect Donald Trump has expressed a keen interest in privatizing the U.S. Postal Service in recent weeks, the Washington Post reported on Saturday, citing three people with k… [+2617 chars]",Yahoo Entertainment,2024-12-14T13:13:13Z
Meta Gives Trump $1 Million for Inauguration as Latest Round of Ass-Kissing Commences,"This week, Meta announced that it had donated $1 million to President-elect Donald Trump’s inaugural fund. The fund is used to finance the festivities that accompany the president-elect’s inauguratio… [+4285 chars]",Gizmodo.com,2024-12-12T21:05:21Z
Tim Cook visiting Mar-a-Lago for Friday night dinner with Trump,"Apple CEO Tim Cook is set to visit Mar-a-Lago on Friday night to dine with President-elect Donald Trump, according to a report from The New York Times. Cook joins a string of other tech leaders who h… [+1567 chars]",9to5Mac,2024-12-14T00:34:41Z
"I Was Having Sex With An Old Hookup. Midway Through, I Discovered He Was A Trump Supporter.","When comedians Billy Eichner and Will Ferrell hit the streets in a video released in October repping loud white men for Kamala Harris, I was delighted. I was even happier when three women they approa… [+7426 chars]",HuffPost,2024-12-09T14:31:02Z
Trump picks hardline Republican Kari Lake to lead Voice of America,"(Reuters) -U.S. President-elect Donald Trump on Wednesday said he was picking Kari Lake, a former news anchor and a hardline Republican who failed to win an Arizona Senate seat last month, to be the … [+1073 chars]",Yahoo Entertainment,2024-12-12T02:28:40Z
FBI Director Chris Wray to resign following Trump nomination of Patel,"If you click 'Accept all', we and our partners, including 237 who are part of the IAB Transparency &amp; Consent Framework, will also store and/or access information on a device (in other words, use … [+678 chars]",Yahoo Entertainment,2024-12-11T19:10:30Z
Donald Trump wants Kari Lake to run Voice of America. That's not his call. | Opinion,President-elect Donald Trump's announcement Wednesday that he wants Kari Lake to run Voice of America was heavy with his usual bombastic nonsense but light on details for how she might actually get t… [+6480 chars],USA Today,2024-12-14T09:03:21Z
"Court ruling sends jolt through the core of U.S. conservatives, Fox News 'Trump staffing agency'","If you click 'Accept all', we and our partners, including 237 who are part of the IAB Transparency &amp; Consent Framework, will also store and/or access information on a device (in other words, use … [+678 chars]",Yahoo Entertainment,2024-12-11T05:58:38Z
Trump calls for immediate ceasefire in Ukraine and says a US withdrawal from NATO is possible,"Yahoo is using AI to generate takeaways from this article. This means the info may not always match what's in the article. Reporting mistakes helps us improve the experience.Generate Key Takeaways
W… [+7496 chars]",Yahoo Entertainment,2024-12-08T12:02:08Z
Lara Trump steps down as RNC co-chair and addresses speculation about Florida Senate seat,"If you click 'Accept all', we and our partners, including 237 who are part of the IAB Transparency &amp; Consent Framework, will also store and/or access information on a device (in other words, use … [+678 chars]",Yahoo Entertainment,2024-12-09T03:18:52Z
"Trump invites China's Xi Jinping to attend inauguration, CBS News reports","If you click 'Accept all', we and our partners, including 237 who are part of the IAB Transparency &amp; Consent Framework, will also store and/or access information on a device (in other words, use … [+678 chars]",Yahoo Entertainment,2024-12-12T00:14:57Z
"Xi’s RSVP is a snub to Trump, but the inauguration invite is still a big deal","If you click 'Accept all', we and our partners, including 237 who are part of the IAB Transparency &amp; Consent Framework, will also store and/or access information on a device (in other words, use … [+678 chars]",Yahoo Entertainment,2024-12-13T02:37:15Z
Tim Cook rumored to be meeting with Donald Trump for dinner on Friday,"After a whirlwind tour of Europe and the UK, Apple CEO Tim Cook is said to be meeting with President Elect Donald Trump for dinner on Friday night.
The conversation between Cook and Trump, expected … [+3592 chars]",AppleInsider,2024-12-14T00:17:41Z
Trump May Kill Crash Reporting Requirements Tesla Has Fought Against,"Good morning! Its Friday, December 13, 2o24, and this is The Morning Shift, your daily roundup of the top automotive headlines from around the world, in one place. Here are the important stories you … [+10504 chars]",Jalopnik,2024-12-13T15:50:00Z
Here's what a second Trump presidency could mean for scientists,"U.S. President Donald Trump speaks during an event at Snap-On Tools Corp. headquarters in Kenosha, Wisconsin, U.S., on Tuesday, April 18, 2017.
Daniel Acker/Bloomberg via Getty Images
The next four… [+1293 chars]",NPR,2024-12-09T08:00:57Z
"Jesse Ventura: Donald Trump Stole My Playbook, He Couldn’t Hold A Candle To Me In A Debate","Yahoo is using AI to generate takeaways from this article. This means the info may not always match what's in the article. Reporting mistakes helps us improve the experience.Generate Key Takeaways
W… [+2408 chars]",Yahoo Entertainment,2024-12-07T20:00:00Z
"Donald Trump plans to 'make America the crypto capital of the world,' Eric Trump says","In This Story
President-elect Donald Trump plans to make America a leader in the cryptocurrency space, through investments and sensible regulations.
Eric Trump said his father realizes that every c… [+2515 chars]",Quartz India,2024-12-09T16:40:51Z
Trump says he supports DREAMers. His past actions say differently.,"In a recent Meet the Press interview, President-elect Donald Trump claimed hes open to working with Democrats on legislation that could keep DREAMers undocumented immigrants who came to the US as chi… [+8827 chars]",Vox,2024-12-11T17:59:03Z
