title,content,source_name,published_at
Automakers say they need a 'miracle' to meet EV transition timelines. They think Trump could help.,"Automakers are facing lower-than-expected demand for EVs this year.Shutterstock
<ul><li>Auto execs see an opportunity to roll back state EV mandates under President-elect Donald Trump.</li><li>Nissa… [+5597 chars]",Business Insider,2024-12-06T09:14:01Z
Biden launched a US chipmaking boom. The jobs boost will come under Trump.,"US hiring for semiconductor manufacturing jobs could come during the Trump administration as factories come online.Credit: Walden Kirsch/Intel Corporation
<ul><li>The Biden administration secured co… [+6392 chars]",Business Insider,2024-12-08T09:45:01Z
Anyone can give Donald Trump $1 million. The pros do it in public.,"Tech moguls are lining up to give Donald Trump money — and, crucially, to make sure everyone knows about it.Joe Raedle/Getty Images
<ul><li>It's not new for rich people and big companies to donate t… [+3863 chars]",Business Insider,2024-12-13T18:51:29Z
Trump inviting Xi to his inauguration is an audacious power play,"President Donald Trump and China's President Xi Jinping arrive at a state dinner in Beijing in November 2017.Thomas Peter - Pool/Getty Images
<ul><li>Trump's decision to invite China's Xi Jinping to… [+4439 chars]",Business Insider,2024-12-14T10:00:01Z
China's Xi sets boundaries for Trump with 4 'red lines',"If you click 'Accept all', we and our partners, including 237 who are part of the IAB Transparency &amp; Consent Framework, will also store and/or access information on a device (in other words, use … [+678 chars]",Yahoo Entertainment,2024-11-18T07:09:34Z
Trump immigration crackdown: Denaturalization just a drop in the bucket,"If you click 'Accept all', we and our partners, including 237 who are part of the IAB Transparency &amp; Consent Framework, will also store and/or access information on a device (in other words, use … [+678 chars]",Yahoo Entertainment,2024-11-22T11:00:00Z
Putin Offers Bizarre Warning to Trump: You’re ‘Not Safe’,"If you click 'Accept all', we and our partners, including 237 who are part of the IAB Transparency &amp; Consent Framework, will also store and/or access information on a device (in other words, use … [+678 chars]",Yahoo Entertainment,2024-11-29T01:54:20Z
Trump to discuss ending childhood vaccination programs with RFK Jr,"If you click 'Accept all', we and our partners, including 237 who are part of the IAB Transparency &amp; Consent Framework, will also store and/or access information on a device (in other words, use … [+678 chars]",Yahoo Entertainment,2024-12-12T17:22:13Z
"Trump, GOP expected to undo Biden’s divisive nursing home rule","If you click 'Accept all', we and our partners, including 237 who are part of the IAB Transparency &amp; Consent Framework, will also store and/or access information on a device (in other words, use … [+678 chars]",Yahoo Entertainment,2024-12-11T11:00:00Z
Trump reportedly considering DeSantis as replacement nominee for defense secretary,"TAMPA, Fla. (WFLA) Several reports, including from the Wall Street Journal, have said Governor Ron DeSantis could become President-elect Trumps new defense secretary nominee. The news comes amid a gr… [+1101 chars]",WFLA,2024-12-04T12:43:57Z
Idiot Trump Accidentally Gives Democrats a Massive Boost,"If you click 'Accept all', we and our partners, including 237 who are part of the IAB Transparency &amp; Consent Framework, will also store and/or access information on a device (in other words, use … [+678 chars]",Yahoo Entertainment,2024-11-20T20:26:02Z
Trump: ‘No more Judges confirmed before Inauguration Day!’,"If you click 'Accept all', we and our partners, including 237 who are part of the IAB Transparency &amp; Consent Framework, will also store and/or access information on a device (in other words, use … [+678 chars]",Yahoo Entertainment,2024-11-19T19:20:53Z
Trump Pick Linda McMahon Is Facing Her Own Sex Scandal,"Former WWE CEO Linda McMahon left the spectacle of televised wrestling more than a decade ago, but her new appointment to Donald Trumps administration has brought fresh scrutiny to her time presiding… [+3676 chars]",Daily Beast,2024-11-20T17:18:10Z
Trump taps Brendan Carr to chair Federal Communications Commission,"If you click 'Accept all', we and our partners, including 237 who are part of the IAB Transparency &amp; Consent Framework, will also store and/or access information on a device (in other words, use … [+678 chars]",Yahoo Entertainment,2024-11-18T00:38:10Z
Mexico seeks Trump agreement to avoid receiving non-Mexican deportees,"If you click 'Accept all', we and our partners, including 237 who are part of the IAB Transparency &amp; Consent Framework, will also store and/or access information on a device (in other words, use … [+678 chars]",Yahoo Entertainment,2024-12-05T15:06:16Z
Cheney responds to Trump jail threat: ‘Here’s the truth’,"Yahoo is using AI to generate takeaways from this article. This means the info may not always match what's in the article. Reporting mistakes helps us improve the experience.Generate Key Takeaways
F… [+2911 chars]",The Hill,2024-12-09T14:11:06Z
"Trump, Harris teams reflect on 2024: Trump assassination attempt and Biden drops out","Senior staffers from the Trump and Harris campaigns met at Harvard Universitys Campaign Managers Conference on Friday to discuss the summer of 2024, which gave way to an unprecedented political seaso… [+6703 chars]",ABC News,2024-12-07T00:34:29Z
Mexico Threatens Retaliatory Tariffs in Response to Trump,"MEXICO CITY President Claudia Sheinbaum suggested Tuesday that Mexico could retaliate with tariffs of its own, after U.S. President-elect Donald Trump threatened to impose 25% import duties on Mexica… [+4435 chars]",Time,2024-11-27T03:30:00Z
Special Counsel Moves to Dismiss Election Interference Case Against Trump,"WASHINGTON Special counsel Jack Smith asked a federal judge on Monday to dismiss the case accusing President-elect Donald Trump of plotting to overturn the 2020 election, citing longstanding Justice … [+2273 chars]",Time,2024-11-25T18:46:09Z
Why Kash Patel Went All In For Trump,"Kash Patel wasnt always a firebrand. Early in his career, as a federal prosecutor and national security lawyer at the Justice Department, Donald Trumps current pick to head the FBI was thoughtful and… [+4781 chars]",Time,2024-12-05T17:08:11Z
The Opposition to Trump Has Never Been This Deflated,"This article is part of The D.C. Brief, TIMEs politics newsletter. Sign up here to get stories like this sent to your inbox.
Around this time eight years ago, a whole lot of time went into cobbling … [+5248 chars]",Time,2024-11-26T11:00:00Z
An investor says he put 98% of his retirement funds in Trump Media stock and won’t bail because Trump has a ‘secret’ plan,"Trump-supporting retirees have gone all-in on investing in Trump Media, even as the stock has proven to be volatile.
One user, who only goes by @DTLjohnny, said on Trump Media-owned Truth Social he … [+4733 chars]",Yahoo Entertainment,2024-11-23T10:07:00Z
Trump calls for ending daylight saving time,"President-elect Donald Trump said Friday he's in favor of eliminating daylight saving time, calling it ""inconvenient"" and ""very costly"" as his Department of Government Efficiency (DOGE) directors als… [+886 chars]",ABC News,2024-12-13T20:58:52Z
Trump is directing the trade war even before he takes office. Surprise tariffs were just the start.,"Michael B. Thomas/Getty Images; Rebecca Zisser/BI
<ul><li>US President-elect Trump announced sweeping tariffs on Mexico, Canada, China, impacting global markets and currencies.</li><li>Some analysts… [+3681 chars]",Business Insider,2024-11-27T07:48:08Z
Maye Musk talks about Elon and Trump like they're toddlers on a playdate: 'They just seem to be having fun',"Tesla CEO Elon Musk has been spending a lot of time with Donald Trump following his election win.Jeff Bottari/Zuffa LLC
<ul><li>Elon Musk's mother talks about his friendship with Donald Trump like t… [+3088 chars]",Business Insider,2024-11-27T12:12:19Z
Trump picked a Project 2025 coauthor to run the FCC. Here's what it means for Big Tech.,"Trump's pick to lead the FCC, Brendan Carr, wants Big Tech to start contributing to federal funds and to be compelled not to censor content.Andrew Harnik/Getty Images and Celal Gunes/Anadolu via Gett… [+4254 chars]",Business Insider,2024-11-18T10:23:02Z
It looks like Donald Trump will get to fly on his cut-price Air Force One after all,"Donald Trump renegotiated the Next Air Force One deal with Boeing's CEO during his first presidency.Alex Wong/Getty Images
<ul><li>Donald Trump renegotiated a deal with Boeing for a new Air Force On… [+4487 chars]",Business Insider,2024-11-21T13:35:16Z
Trump has been tough on EVs. Now Elon Musk is his best friend and nobody knows how it'll play out.,"President-elect Donald Trump greets Elon Musk before the launch of the sixth test flight of the SpaceX Starship rocket Tuesday, Nov. 19, 2024 in Brownsville, Texas.Brandon Bell/Pool via AP
<ul><li>T… [+4099 chars]",Business Insider,2024-11-25T10:57:02Z
An iconic 'Ferris Bueller's Day Off' clip is going viral as Trump rolls out more tariff plans,"""Ferris Bueller's Day Off"" premiered in 1986, and scene from is making its rounds on TikTok.Archive Photos/Getty Images
<ul><li>A ""Ferris Bueller's Day Off"" scene is going viral amid Donald Trump's … [+2460 chars]",Business Insider,2024-11-27T19:09:08Z
Elon Musk spent at least $277 million backing Trump and the GOP. Here's where all of that money went.,"Elon Musk with his son, X Æ A-12, on Capitol Hill on Thursday.Samuel Corum/Getty Images
<ul><li>Elon Musk spent at least $277 million on Trump and the GOP, according to new documents.</li><li>Most o… [+4159 chars]",Business Insider,2024-12-06T17:57:22Z
"Even if Trump tried to raise the minimum wage, his own party could get in the way","Trump recently signaled openness to raising the federal minimum wage, but that's likely to hit GOP resistance.Jeff Bottari/Zuffa LLC via Getty Images
<ul><li>Trump said on Sunday that he'd consider … [+4890 chars]",Business Insider,2024-12-11T15:47:47Z
"Critics said Musk 'overpaid' for Twitter. Thanks to Trump and xAI, it could actually be a steal.","Elon Musk acquired Twitter at $44 billion, but investors have been writing down its paper value.Samuel Corum/Getty Images
<ul><li>Elon Musk's $44 billion Twitter buyout was seen by many as overprice… [+7220 chars]",Business Insider,2024-12-02T09:00:01Z
Diddy cites Trump in arguing he has the right to say almost anything while awaiting his sex-trafficking trial,"Diddy attends the 2023 MTV Video Music Awards at the Prudential Center in Newark, New Jersey, U.S., September 12, 2023.REUTERS/Andrew Kelly
<ul><li>Sean ""Diddy"" Combs could be released on bail for T… [+4232 chars]",Business Insider,2024-11-25T18:55:33Z
Kamala Harris' campaign has $1.8 million left in the bank after spending over $1 billion to defeat Donald Trump,"Vice President Kamala Harris had no problem raising money during the presidential race.ANGELA WEISS/AFP via Getty Images
<ul><li>The Harris campaign has $1.8 million cash after spending over $1 bill… [+2848 chars]",Business Insider,2024-12-07T23:59:06Z
"Massad Boulos, hailed as a billionaire lawyer advising Trump on Middle East policy, probably isn't a lawyer or a billionaire","Michael Boulos worked to boost Donald Trump in Michigan ahead of the general election.Jeenah Moon for The Washington Post via Getty Images
<ul><li>Massad Boulos helped Trump win Arab voters in Michi… [+7544 chars]",Business Insider,2024-12-12T22:03:48Z
"CEOs and companies are breaking out their wallets for Trump, from Sam Altman to Jeff Bezos and Mark Zuckerberg","Donald Trump is raking in millions in donations to his inaugural fund from many notable business leaders.Anna Moneymaker/Getty Images
<ul><li>Donald Trump is getting donations left and right from th… [+2702 chars]",Business Insider,2024-12-13T17:57:07Z
Nikki Haley skewers controversial Trump nominees,"The sudden withdrawal of former Florida Rep. Matt Gaetz, President-elect Donald Trump's embattled pick for attorney general, amid opposition from Senate Republicans marks the first major setback for … [+5567 chars]",ABC News,2024-11-21T22:46:11Z
"In an F-35 funding fight, Musk will need to win over a skeptical Congress and Trump","A US F-35 in flight.US Air Force photo by Senior Airman Jack Rodgers
<ul><li>Elon Musk sharply criticized the F-35 stealth jet and its builder, Lockheed Martin.</li><li>Musk could target the expensi… [+5674 chars]",Business Insider,2024-11-27T09:00:02Z
Trump tariffs would increase the price of cars made by US automakers by over $2K: Wells Fargo,"President-elect Donald Trump's proposed tariffs could negatively impact the US automaking industry.Allison Robbert-Pool/Getty Images
<ul><li>Donald Trump said he'd put in place 25% tariffs on Mexica… [+2836 chars]",Business Insider,2024-11-28T13:12:51Z
Trump says he doesn't 'believe' Americans will pay more under his tariff plan but 'can't guarantee anything',"President-elect Donald Trump reiterated that he's a ""big believer in tariffs"" on NBC's ""Meet the Press"" on Sunday.Remon Haazen/Getty Images
<ul><li>Trump has proposed 25% tariffs on imports from Can… [+2813 chars]",Business Insider,2024-12-08T16:36:43Z
Biden says it was 'stupid' not to have signed his name on COVID-19 stimulus checks like Trump,"President Joe Biden touted the American Rescue Plan during a speech at the Brookings Institute.Kevin Dietsch/Getty Images
<ul><li>President Biden touted his economic record during a Tuesday speech a… [+2245 chars]",Business Insider,2024-12-10T19:16:24Z
House Democrat says Trump is 'off to a good start' with tariff threats on Mexico and Canada,"Rep. Jared Golden, a centrist Democrat from Maine, previously introduced a bill to enact Trump's 10% tariff plan into law.AP Photos/Sarah Meyssonnier and Robert F. Bukaty
<ul><li>Trump said he plans… [+3271 chars]",Business Insider,2024-12-12T19:09:36Z
The Trump Marathon,"This is an edition of The Atlantic Daily, a newsletter that guides you through the biggest stories of the day, helps you discover new ideas, and recommends the best in culture. Sign up for it here.In… [+11650 chars]",The Atlantic,2024-11-25T23:31:00Z
The Trump-Trumpist Divide,"Members of Donald Trump’s inner circle understandably wish to interpret the election results as a mandate for the most extreme right-wing policies, which include conducting mass deportations and crus… [+5619 chars]",The Atlantic,2024-11-22T11:30:00Z
Trump announces Jamieson Greer as his pick to lead U.S. trade,"President-elect Donald Trump on Tuesday chose trade lawyer Jamieson Greer as his new U.S. trade representative, elevating a key veteran of his first-term trade war against China to execute a sweeping… [+3130 chars]",Fast Company,2024-11-27T13:25:18Z
Trump said he wants 100% tariffs on some of the countries trying to move away from the dollar. That could hurt the US.,"US President-elect Donald Trump issued a new tariff threat over the weekend, this time against countries seeking to find US dollar alternatives but in doing so, he may be elevating a non-threat, said… [+5810 chars]",Business Insider,2024-12-02T08:47:28Z
Trump team says Israel-Hezbollah ceasefire deal brokered by Biden is actually Trump's win,"Yahoo is using AI to generate takeaways from this article. This means the info may not always match what's in the article. Reporting mistakes helps us improve the experience.Generate Key Takeaways
W… [+6160 chars]",Yahoo Entertainment,2024-11-27T00:35:07Z
"Trump still hasn't signed agreements to begin transition of power, White House says","If you click 'Accept all', we and our partners, including 237 who are part of the IAB Transparency &amp; Consent Framework, will also store and/or access information on a device (in other words, use … [+678 chars]",Yahoo Entertainment,2024-11-22T00:29:25Z
Young men swung to the right for Trump after a campaign dominated by masculine appeals,"If you click 'Accept all', we and our partners, including 237 who are part of the IAB Transparency &amp; Consent Framework, will also store and/or access information on a device (in other words, use … [+678 chars]",Yahoo Entertainment,2024-11-30T18:11:24Z
Europe-loving Blinken on last trip to NATO before Trump handover,"Yahoo is using AI to generate takeaways from this article. This means the info may not always match what's in the article. Reporting mistakes helps us improve the experience.Generate Key Takeaways
A… [+3573 chars]",Yahoo Entertainment,2024-12-03T17:48:07Z
Trump says anyone investing $1 billion in US will receive expedited permits,"WASHINGTON (Reuters) -U.S. President-elect Donald Trump said on Tuesday that any person or company investing at least $1 billion into the U.S. ""will receive fully expedited approvals and permits, inc… [+1078 chars]",Yahoo Entertainment,2024-12-10T19:39:46Z
"Trump now says bringing down grocery prices, as he promised, will be 'very hard'","If you click 'Accept all', we and our partners, including 237 who are part of the IAB Transparency &amp; Consent Framework, will also store and/or access information on a device (in other words, use … [+678 chars]",Yahoo Entertainment,2024-12-13T17:07:00Z
"Trump picks Ron Johnson as ambassador to Mexico, leading to confusion, jokes in Wisconsin","President-elect Donald Trump announced Tuesday night he selected Ron Johnson to serve as U.S. Ambassador to Mexico but it's not Wisconsin's U.S. Sen. Ron Johnson.
This Ron Johnson, Trump said in a s… [+2041 chars]",Milwaukee Journal Sentinel,2024-12-11T17:09:59Z
"Trump Admits He Lied About Grocery Prices, Celebrates TIME Cover on Wall Street: A Closer Look","If you click 'Accept all', we and our partners, including 237 who are part of the IAB Transparency &amp; Consent Framework, will also store and/or access information on a device (in other words, use … [+678 chars]",Yahoo Entertainment,2024-12-13T02:00:00Z
Geraldo Rivera Slaps Trump Supporters With A Reality Check After Biden’s Pardon,"If you click 'Accept all', we and our partners, including 237 who are part of the IAB Transparency &amp; Consent Framework, will also store and/or access information on a device (in other words, use … [+678 chars]",Yahoo Entertainment,2024-12-02T12:44:57Z
Mexico’s president on Trump threat: ‘One tariff would be followed by another in response’,"Yahoo is using AI to generate takeaways from this article. This means the info may not always match what's in the article. Reporting mistakes helps us improve the experience.Generate Key Takeaways
M… [+2469 chars]",The Hill,2024-11-26T16:40:29Z
I’m Speechless At These 12 People Who Had Literally No Idea What Their Trump Vote Meant,"If you click 'Accept all', we and our partners, including 237 who are part of the IAB Transparency &amp; Consent Framework, will also store and/or access information on a device (in other words, use … [+678 chars]",Yahoo Entertainment,2024-12-04T18:51:58Z
Trump wants pardoned real estate developer Charles Kushner to become US ambassador to France,"If you click 'Accept all', we and our partners, including 237 who are part of the IAB Transparency &amp; Consent Framework, will also store and/or access information on a device (in other words, use … [+678 chars]",Yahoo Entertainment,2024-11-30T19:42:39Z
GOP senators squirm over sex-related allegations against Trump Cabinet picks,"If you click 'Accept all', we and our partners, including 237 who are part of the IAB Transparency &amp; Consent Framework, will also store and/or access information on a device (in other words, use … [+678 chars]",Yahoo Entertainment,2024-11-25T11:00:00Z
Donald Trump endorses Florida CFO Jimmy Patronis to replace Matt Gaetz in Congress,"If you click 'Accept all', we and our partners, including 237 who are part of the IAB Transparency &amp; Consent Framework, will also store and/or access information on a device (in other words, use … [+678 chars]",Yahoo Entertainment,2024-11-25T19:23:48Z
Opinion - President Biden is leaving Trump a shocking mess to clean up,"What an incredible mess Joe Biden will be leaving for Donald Trump on Jan. 20.
It isnt just the $36 trillion in federal debt (up $13 trillion since 2020), which has increasingly (and foolishly) been… [+5955 chars]",The Hill,2024-12-06T13:00:00Z
Gingrich: Xi attending Trump inauguration would be ‘signal to the planet’,"Former House Speaker Newt Gingrich (R-Ga.) responded to President-elect Trumps invitation to Chinese President Xi Jinping to attend Inauguration Day in January, saying his acceptance would send a glo… [+1850 chars]",The Hill,2024-12-12T13:52:14Z
Trump Sends Warning Shot to Putin as He Hails That ‘Assad is Gone’,"With the regime of his Syrian ally Bashar al-Assad toppled in Damascus, Russian leader Vladimir Putin received a public warning from President-elect Donald Trump, who urged him to agree to a ceasefir… [+2799 chars]",Daily Beast,2024-12-08T14:24:39Z
Mitch McConnell Gets Standing Ovation After Taking a Subtle Swipe at Trump,"If you click 'Accept all', we and our partners, including 237 who are part of the IAB Transparency &amp; Consent Framework, will also store and/or access information on a device (in other words, use … [+678 chars]",Yahoo Entertainment,2024-12-09T03:45:30Z
Syrian rebel leader’s victory speech holds a message for Iran – and for Trump and Israel too,"If you click 'Accept all', we and our partners, including 237 who are part of the IAB Transparency &amp; Consent Framework, will also store and/or access information on a device (in other words, use … [+678 chars]",Yahoo Entertainment,2024-12-09T00:08:16Z
"Mexico warns Trump tariffs would kill 400,000 US jobs, threatens retaliation","If you click 'Accept all', we and our partners, including 237 who are part of the IAB Transparency &amp; Consent Framework, will also store and/or access information on a device (in other words, use … [+678 chars]",Yahoo Entertainment,2024-11-27T14:17:22Z
Russia says Trump Ukraine aid cut would be 'death sentence' for Kyiv's military,"If you click 'Accept all', we and our partners, including 237 who are part of the IAB Transparency &amp; Consent Framework, will also store and/or access information on a device (in other words, use … [+678 chars]",Yahoo Entertainment,2024-11-27T19:10:36Z
The Trump Economy Begins: 4 Money Moves Retirees Should Make Before Inauguration Day,"If you click 'Accept all', we and our partners, including 237 who are part of the IAB Transparency &amp; Consent Framework, will also store and/or access information on a device (in other words, use … [+678 chars]",Yahoo Entertainment,2024-11-26T14:00:30Z
Attorneys for man accused in Trump assassination attempt seek lengthy trial delay,"Yahoo is using AI to generate takeaways from this article. This means the info may not always match what's in the article. Reporting mistakes helps us improve the experience.Generate Key Takeaways
F… [+4221 chars]",Yahoo Entertainment,2024-12-11T19:14:08Z
Trump Suddenly Changes His Tune With New Daylight Savings Time Promise,"If you click 'Accept all', we and our partners, including 237 who are part of the IAB Transparency &amp; Consent Framework, will also store and/or access information on a device (in other words, use … [+678 chars]",Yahoo Entertainment,2024-12-13T22:26:35Z
"Democratic governors discuss going on offense, playing defense against Trump","As Democratic governors prepare to navigate and resist parts of President-elect Donald Trump's next administration, one told ABC News she is most alarmed by Trump's tariff plan.
""Tariffs would be de… [+9888 chars]",ABC News,2024-12-10T22:28:46Z
"'Accountability is occurring,' Secret Service director on Trump assassination attempt","Accountability for the members of the Secret Service who were at fault for the July 13 assassination attempt against President-elect Donald Trump is ""occurring,"" Acting Director of the Secret Service… [+2522 chars]",ABC News,2024-12-05T11:04:58Z
FBI Director Chris Wray resigning amid pressure from Trump,"FBI Director Christopher Wray told employees at an internal town hall on Wednesday that he is resigning, according to sources familiar with the meeting.
He said he is stepping down at the end of the… [+2727 chars]",ABC News,2024-12-11T19:14:08Z
"Ahead of Trump's inauguration, Trump Organization expands its global business","As Donald Trump prepares to return to the White House, his namesake company is expanding its global footprint.
Trump's son Eric Trump, an executive vice president with the Trump Organization, on Wed… [+2731 chars]",ABC News,2024-12-13T03:41:05Z
Trump picks Florida sheriff Chad Chronister for DEA administrator,"President-elect Donald Trump announced he will nominate Hillsborough County Sheriff Chad Chronister to lead the Drug Enforcement Administration.
In a post on Truth Social on Saturday, Trump said tha… [+1214 chars]",ABC News,2024-12-01T01:57:20Z
Trump names longtime ally Kash Patel to lead FBI,"President-elect Donald Trump announced Saturday that he plans on firing FBI director Christopher Wray and replacing him with longtime ally Kash Patel.
The appointment must be approved by the Senate.… [+7077 chars]",ABC News,2024-12-01T21:36:30Z
Biden calls Trump tariff approach 'a major mistake',"President Joe Biden delivered remarks Tuesday focused on his administrations economic legacy, drawing a sharp contrast between his four years in office and President-elect Donald Trumps past and futu… [+3977 chars]",ABC News,2024-12-10T22:23:41Z
